Video ID,Title,SOALAS Count,LAS Count,Applewood Count
IInYY3tkshE,PRIME RIB Laced w/ Bacon & Blue Cheese #shorts,1,1,1
ROxD5KeuPTU,Fresh EEL Sushi #shorts,0,0,0
-4MKnJY-2hc,VENISON Rib Roast #shorts,0,1,1
d7aB-aTdc4c,Black Hawk BEEF Bomb #shorts,0,1,1
ja_Uw62RulA,Root Beer Glazed RIBS x Root Beer Float #shorts,0,1,1
Lkx2dacy-PQ,LAMB Rack x Balsamic Blackberry Glaze #shorts,0,1,1
hBd1FRlHczg,Smoked SALMON x Cinnamon Roll #shorts,0,0,1
eqE0ag_XYsA,Will it Easy Bake: WAGYU A5 & Truffles #shorts,0,0,0
xdSGOWKt_6o,Holiday Tree. Meat Galore. #shorts,0,0,0
D1SeFPWNxss,Candied BACON: Chocolate x Sriracha #shorts,0,0,0
ecxEdDh1GJ0,Boneless Wings EXPOSED #shorts,0,0,0
wPm6qrUuvGI,Taco TWINKIE x Flaming Hot Mozzarella Stick #shorts,0,0,0
OQ435x0Kf1s,The TURKEY FOOTBALL #shorts,0,1,1
A9tZvbzU0zs,Will it EASY BAKE? pt2 Baby Back Ribs #shorts,0,0,0
ya64LQKTGBs,Will it EASY BAKE? pt1 Ribeye and Potatoes 🥩🥔  #shorts,0,0,0
MWLYWOtmJVY,The STEAK Cake 🥩 🎂 #shorts,0,1,1
5OLKyNq1aF0,3 Perfect STEAK Sauces 🥩,0,0,0
AqqH_AEcJ8Q,The Pork PRETZEL 🐽 + 🥨,0,1,1
IU_0YZ_Bshw,WELLINGTON Steak Cake! Happy Birthday Gordon Ramsay & Tilly Ramsay🥩🎂🥖,0,0,0
MZ5z_XEM0M8,Prime Rib Laced With BACON 🥩🥓,0,1,0
